{
  "schemaVersion": "steam-radar-data-v1",
  "runId": "steam-radar:2026-09-26T13",
  "scheduledAt": "2026-09-26T13:23:47.518Z",
  "collectedAt": "2026-09-26T13:23:47.519Z",
  "collectorVersion": "beec1bd8dfb14aa41b0da9772248b934be7b5e97",
  "source": {
    "name": "Steam Search",
    "url": "https://store.steampowered.com/search/results/?query&start=0&count=50&sort_by=Released_DESC&supportedlang=english&infinite=1&json=1",
    "scope": "Steam 英文区最新发布，最多 50 条"
  },
  "providerStatus": {
    "steamSearch": "FRESH",
    "steamLiveEvidence": "FRESH",
    "googleSuggest": "CACHED",
    "serp": "CACHED"
  },
  "items": [
    {
      "game": {
        "appId": "5217130",
        "title": "Mine Mine Mine Demo",
        "url": "https://store.steampowered.com/app/5217130/",
        "capsuleUrl": "https://shared.fastly.steamstatic.com/store_item_assets/steam/apps/5217130/6036486d33d4e6b786e27821b2524a8451db96ca/capsule_231x87.jpg?t=1790421226",
        "releaseDate": "Sep 26, 2026",
        "releaseDateIso": "2026-09-26T00:00:00.000Z",
        "daysSinceRelease": 0,
        "platforms": [
          "win"
        ],
        "tagIds": [
          492
        ],
        "kind": "demo",
        "priceLabel": "Free",
        "isFree": true,
        "discountPercent": 0,
        "reviewLabel": null,
        "score": 42,
        "signals": [
          "24 小时发布窗口",
          "免费游玩"
        ],
        "keywordIdeas": [
          "Mine Mine Mine Demo wiki",
          "Mine Mine Mine Demo guide",
          "Mine Mine Mine Demo walkthrough",
          "Mine Mine Mine Demo best build",
          "Mine Mine Mine Demo tier list",
          "Mine Mine Mine Demo map",
          "Mine Mine Mine Demo boss guide",
          "Mine Mine Mine Demo items",
          "Mine Mine Mine Demo weapons",
          "Mine Mine Mine Demo codes",
          "Mine Mine Mine Demo achievements",
          "Mine Mine Mine Demo calculator"
        ],
        "currentPlayers": null,
        "playerDelta3h": null,
        "reviewTotal": null,
        "reviewDelta6h": null,
        "evidenceCoverage": 20,
        "siteScore": null,
        "confidenceScore": 20,
        "momentumScore": null,
        "searchDemandScore": null,
        "serpOpportunityScore": null,
        "competitorCount": null,
        "action": "skip",
        "confidence": "low",
        "reasonCodes": [],
        "missingEvidence": [
          "PLAYER_HISTORY_3H",
          "SEARCH",
          "SERP"
        ],
        "searchQueries": [],
        "matchedIntents": [],
        "serpProvider": null,
        "serpResults": [],
        "trend14d": [],
        "nextStep": "继续采集玩家历史、搜索与 SERP 证据",
        "watched": false
      },
      "live": null,
      "search": null,
      "serp": null
    },
    {
      "game": {
        "appId": "4953150",
        "title": "Fiducia: Rent The World",
        "url": "https://store.steampowered.com/app/4953150/",
        "capsuleUrl": "https://shared.fastly.steamstatic.com/store_item_assets/steam/apps/4953150/bf8f4224f5dcc9c123f8efcb29561063061c3e07/capsule_231x87.jpg?t=1790420921",
        "releaseDate": "Sep 26, 2026",
        "releaseDateIso": "2026-09-26T00:00:00.000Z",
        "daysSinceRelease": 0,
        "platforms": [
          "win"
        ],
        "tagIds": [
          9,
          599,
          4695,
          4845,
          6310,
          3859,
          26921
        ],
        "kind": "game",
        "priceLabel": "Free",
        "isFree": true,
        "discountPercent": 0,
        "reviewLabel": null,
        "score": 58,
        "signals": [
          "24 小时发布窗口",
          "免费游玩"
        ],
        "keywordIdeas": [
          "Fiducia: Rent The World wiki",
          "Fiducia: Rent The World guide",
          "Fiducia: Rent The World walkthrough",
          "Fiducia: Rent The World best build",
          "Fiducia: Rent The World tier list",
          "Fiducia: Rent The World map",
          "Fiducia: Rent The World boss guide",
          "Fiducia: Rent The World items",
          "Fiducia: Rent The World weapons",
          "Fiducia: Rent The World codes",
          "Fiducia: Rent The World achievements",
          "Fiducia: Rent The World calculator"
        ],
        "currentPlayers": 1,
        "playerDelta3h": null,
        "reviewTotal": 0,
        "reviewDelta6h": null,
        "evidenceCoverage": 60,
        "siteScore": null,
        "confidenceScore": 20,
        "momentumScore": null,
        "searchDemandScore": null,
        "serpOpportunityScore": null,
        "competitorCount": null,
        "action": "watch",
        "confidence": "low",
        "reasonCodes": [],
        "missingEvidence": [
          "PLAYER_HISTORY_3H",
          "SEARCH",
          "SERP"
        ],
        "searchQueries": [],
        "matchedIntents": [],
        "serpProvider": null,
        "serpResults": [],
        "trend14d": [],
        "nextStep": "继续采集玩家历史、搜索与 SERP 证据",
        "watched": false
      },
      "live": {
        "currentPlayers": 1,
        "reviewTotal": 0,
        "reviewPositive": 0,
        "reviewNegative": 0
      },
      "search": null,
      "serp": null
    },
    {
      "game": {
        "appId": "5320070",
        "title": "Pinball Pirates With Fire and Sword",
        "url": "https://store.steampowered.com/app/5320070/",
        "capsuleUrl": "https://shared.fastly.steamstatic.com/store_item_assets/steam/apps/5320070/ab6ead7e8ab875d0e44dbd8e6d52e11609026a69/capsule_231x87.jpg?t=1790420747",
        "releaseDate": "Sep 26, 2026",
        "releaseDateIso": "2026-09-26T00:00:00.000Z",
        "daysSinceRelease": 0,
        "platforms": [
          "win"
        ],
        "tagIds": [
          19,
          21,
          492,
          597
        ],
        "kind": "game",
        "priceLabel": "$2.39",
        "isFree": false,
        "discountPercent": 20,
        "reviewLabel": null,
        "score": 54,
        "signals": [
          "24 小时发布窗口",
          "首发折扣 20%"
        ],
        "keywordIdeas": [
          "Pinball Pirates With Fire and Sword wiki",
          "Pinball Pirates With Fire and Sword guide",
          "Pinball Pirates With Fire and Sword walkthrough",
          "Pinball Pirates With Fire and Sword best build",
          "Pinball Pirates With Fire and Sword tier list",
          "Pinball Pirates With Fire and Sword map",
          "Pinball Pirates With Fire and Sword boss guide",
          "Pinball Pirates With Fire and Sword items",
          "Pinball Pirates With Fire and Sword weapons",
          "Pinball Pirates With Fire and Sword codes",
          "Pinball Pirates With Fire and Sword achievements",
          "Pinball Pirates With Fire and Sword calculator"
        ],
        "currentPlayers": 0,
        "playerDelta3h": null,
        "reviewTotal": 0,
        "reviewDelta6h": null,
        "evidenceCoverage": 60,
        "siteScore": null,
        "confidenceScore": 20,
        "momentumScore": null,
        "searchDemandScore": null,
        "serpOpportunityScore": null,
        "competitorCount": null,
        "action": "watch",
        "confidence": "low",
        "reasonCodes": [],
        "missingEvidence": [
          "PLAYER_HISTORY_3H",
          "SEARCH",
          "SERP"
        ],
        "searchQueries": [],
        "matchedIntents": [],
        "serpProvider": null,
        "serpResults": [],
        "trend14d": [],
        "nextStep": "继续采集玩家历史、搜索与 SERP 证据",
        "watched": false
      },
      "live": {
        "currentPlayers": 0,
        "reviewTotal": 0,
        "reviewPositive": 0,
        "reviewNegative": 0
      },
      "search": null,
      "serp": null
    },
    {
      "game": {
        "appId": "5039120",
        "title": "Pro Wrestling Tycoon",
        "url": "https://store.steampowered.com/app/5039120/",
        "capsuleUrl": "https://shared.fastly.steamstatic.com/store_item_assets/steam/apps/5039120/eb77358b5f52122ef3279e6c274a2e7e9bd2405f/capsule_231x87.jpg?t=1790420567",
        "releaseDate": "Sep 26, 2026",
        "releaseDateIso": "2026-09-26T00:00:00.000Z",
        "daysSinceRelease": 0,
        "platforms": [
          "win"
        ],
        "tagIds": [
          599,
          701,
          9,
          4364,
          3810,
          9204,
          31275
        ],
        "kind": "game",
        "priceLabel": "$14.99",
        "isFree": false,
        "discountPercent": 0,
        "reviewLabel": null,
        "score": 66,
        "signals": [
          "24 小时发布窗口",
          "攻略意图：tycoon"
        ],
        "keywordIdeas": [
          "Pro Wrestling Tycoon wiki",
          "Pro Wrestling Tycoon guide",
          "Pro Wrestling Tycoon walkthrough",
          "Pro Wrestling Tycoon best build",
          "Pro Wrestling Tycoon tier list",
          "Pro Wrestling Tycoon map",
          "Pro Wrestling Tycoon boss guide",
          "Pro Wrestling Tycoon items",
          "Pro Wrestling Tycoon weapons",
          "Pro Wrestling Tycoon codes",
          "Pro Wrestling Tycoon achievements",
          "Pro Wrestling Tycoon calculator"
        ],
        "currentPlayers": 0,
        "playerDelta3h": null,
        "reviewTotal": 0,
        "reviewDelta6h": null,
        "evidenceCoverage": 60,
        "siteScore": null,
        "confidenceScore": 20,
        "momentumScore": null,
        "searchDemandScore": null,
        "serpOpportunityScore": null,
        "competitorCount": null,
        "action": "validate",
        "confidence": "low",
        "reasonCodes": [],
        "missingEvidence": [
          "PLAYER_HISTORY_3H",
          "SEARCH",
          "SERP"
        ],
        "searchQueries": [],
        "matchedIntents": [],
        "serpProvider": null,
        "serpResults": [],
        "trend14d": [],
        "nextStep": "继续采集玩家历史、搜索与 SERP 证据",
        "watched": false
      },
      "live": {
        "currentPlayers": 0,
        "reviewTotal": 0,
        "reviewPositive": 0,
        "reviewNegative": 0
      },
      "search": null,